{
  "$schema":"https://json-schema.org/draft/2020-12/schema","type":"object","required":["schema_version","contract_id","contract_version","run_id","case_id","stage","attempt","idempotency_key","status","started_at","completed_at","inputs","outputs","result","decisions","warnings","errors","retryable","tool_calls","runtime","publishing_enabled","real_production_enabled"],
  "properties":{
    "schema_version":{"type":"string","enum":["1.0"]},"contract_id":{"type":"string","enum":["cold-truth.writer"]},"contract_version":{"type":"string","enum":["1.0.0-c3-fixture"]},"run_id":{"type":"string","enum":["phase-c3-writer-fixture"]},"case_id":{"type":"string","enum":["glass-river-writing-fixture"]},"stage":{"type":"string","enum":["writer_fixture"]},"attempt":{"type":"integer","enum":[1]},"idempotency_key":{"type":"string","pattern":"^[a-f0-9]{64}$"},"status":{"type":"string","enum":["success"]},"started_at":{"type":"string"},"completed_at":{"type":"string"},
    "inputs":{"type":"array","minItems":3,"maxItems":3,"items":{"type":"object","required":["name","type","kind","path","sha256","size_bytes"],"properties":{"name":{"type":"string"},"type":{"type":"string"},"kind":{"type":"string","enum":["file"]},"path":{"type":"string"},"sha256":{"type":"string"},"size_bytes":{"type":"integer"}},"additionalProperties":false}},"outputs":{"type":"array","maxItems":0,"items":{"type":"object","required":[],"properties":{},"additionalProperties":false}},
    "result":{"type":"object","required":["upstream_research_verifier_handoff_hash","approved_claim_ids","excluded_claim_ids","script_sections","narration_text","claim_attribution_map","word_count","unsupported_claim_check","external_research_used","browser_used","mcp_used","network_used","artifact_hashes","ready_for_editor"],"properties":{
      "upstream_research_verifier_handoff_hash":{"type":"string"},"approved_claim_ids":{"type":"array","const":["SYN-RV-01","SYN-RV-02","SYN-RV-03"],"items":{"type":"string"}},"excluded_claim_ids":{"type":"array","const":["SYN-RV-X1","SYN-RV-X2","SYN-RV-X3"],"items":{"type":"string"}},
      "script_sections":{"type":"array","const":[{"section":"event_date","sentence":"A fictional official record fixes the event date as April 17, 2042."},{"section":"event_location","sentence":"A second fictional official record places the event at Glass River Annex in Example District."},{"section":"current_status","sentence":"A fictional archive records a current-status update dated September 8, 2044."}],"items":{"type":"object","required":["section","sentence"],"properties":{"section":{"type":"string"},"sentence":{"type":"string"}},"additionalProperties":false}},
      "narration_text":{"type":"string"},"claim_attribution_map":{"type":"array","const":[{"sentence_index":1,"claim_id":"SYN-RV-01"},{"sentence_index":2,"claim_id":"SYN-RV-02"},{"sentence_index":3,"claim_id":"SYN-RV-03"}],"items":{"type":"object","required":["sentence_index","claim_id"],"properties":{"sentence_index":{"type":"integer"},"claim_id":{"type":"string"}},"additionalProperties":false}},"word_count":{"type":"integer","enum":[38]},"unsupported_claim_check":{"type":"string","enum":["passed"]},"external_research_used":{"type":"boolean","enum":[false]},"browser_used":{"type":"boolean","enum":[false]},"mcp_used":{"type":"boolean","enum":[false]},"network_used":{"type":"boolean","enum":[false]},"artifact_hashes":{"type":"object","required":[],"properties":{},"additionalProperties":false},"ready_for_editor":{"type":"boolean","enum":[true]}
    },"additionalProperties":false},
    "decisions":{"type":"array","maxItems":1,"items":{"type":"object","required":["rule","result"],"properties":{"rule":{"type":"string"},"result":{"type":"string"}},"additionalProperties":false}},"warnings":{"type":"array","maxItems":0,"items":{"type":"string"}},"errors":{"type":"array","maxItems":0,"items":{"type":"string"}},"retryable":{"type":"boolean","enum":[false]},"tool_calls":{"type":"array","maxItems":0,"items":{"type":"object","required":[],"properties":{},"additionalProperties":false}},"runtime":{"type":"object","required":["provider","runtime","model","version"],"properties":{"provider":{"type":"string"},"runtime":{"type":"string"},"model":{"type":"string"},"version":{"type":"string"}},"additionalProperties":false},"publishing_enabled":{"type":"boolean","enum":[false]},"real_production_enabled":{"type":"boolean","enum":[false]}
  },"additionalProperties":false
}
